category,badge,hero_title,hero_subtitle,button,row1_title,row1_desc,row2_title,row2_desc,row3_title,row3_desc,support_title,support_subtitle,hashtags
INSURANCE,INSURANCE,VEHICLE INSURANCE\nDIRECT RENEWAL,Direct company policy support with no agent model,No Agent • No Commission,DIRECT POLICY,Policy issued by Insurance Company,ZERO COMMISSION,No agent • No brokerage,CUSTOMER CONTROL,Policy ownership with customer,Direct Insurance Support Platform,Policy issued directly by Insurance Company,#VehicleInsurance #InsuranceRenewal #DirectCompanyPolicy #NoAgent #NoCommission #MetaSolwServices #Kanpur
AUDIT REPORT,AUDIT REPORT,FLEET AUDIT REPORT,Vehicle documents insurance fitness aur permit ka clean check,Audit Report Support,RC / INSURANCE AUDIT,Vehicle RC aur insurance document status check,FITNESS / PERMIT REVIEW,Commercial vehicle fitness aur permit review,CLEAN RISK SUMMARY,Fleet ka simple professional risk summary,Professional Audit Support Platform,RC • Insurance • Fitness • Permit • Risk Summary,#AuditReport #FleetAudit #VehicleAudit #DocumentCheck #InsuranceCheck #FitnessCertificate #MetaSolwServices #Kanpur
RTO SUPPORT,RTO SUPPORT,RTO DOCUMENT\nSUPPORT,RC transfer permit fitness aur document work support,RTO Support,RC WORK,Transfer correction and registration guidance,PERMIT / FITNESS,Permit tax and fitness support,DOCUMENT HELP,Vehicle document support,Professional RTO Support Platform,RC • Permit • Fitness • Transfer • Tax,#RTO #RTOServices #RCTransfer #FitnessCertificate #PermitWork #MetaSolwServices #Kanpur
CLAIM SUPPORT,CLAIM SUPPORT,CLAIM SUPPORT\nDOCUMENTATION,Insurance claim documents aur follow up guidance,Claim Support,DOCUMENT GUIDANCE,Claim related document checking,CLAIM ASSISTANCE,Professional claim support guidance,FOLLOW UP SUPPORT,Clear process and update support,Claim Documentation Support Platform,Document • Claim • Follow-up • Guidance,#ClaimSupport #InsuranceClaim #DocumentationHelp #MetaSolwServices #Kanpur
DOCUMENT CHECK,DOCUMENT CHECK,FREE DOCUMENT\nCHECK,RC insurance permit fitness ka quick document review,Free Document Check,RC CHECK,Vehicle RC document review,INSURANCE CHECK,Policy status and expiry check,PERMIT / FITNESS,Permit and fitness review,Vehicle Document Check Platform,RC • Insurance • Permit • Fitness,#DocumentCheck #RCCheck #InsuranceCheck #PermitCheck #FitnessCertificate #MetaSolwServices #Kanpur
TRANSPORT SUPPORT,TRANSPORT,TRANSPORT OWNER\nSUPPORT,Commercial vehicle owners ke liye insurance RTO audit help,Transport Support,COMMERCIAL POLICY,Commercial vehicle insurance support,PERMIT REVIEW,Permit and document checking,FLEET GUIDANCE,Fleet audit and renewal support,Transport Support Platform,Insurance • RTO • Audit • Permit,#TransportSupport #CommercialVehicle #FleetSupport #TruckInsurance #MetaSolwServices #Kanpur
LEGAL,LEGAL,LEGAL DOCUMENTATION\nSUPPORT,Legal documents aur claim support ke liye connect karein,Documentation Support,LEGAL DOCUMENTS,Documentation checking support,CLAIM GUIDANCE,Claim support and process help,PROFESSIONAL HELP,Clear guidance and assistance,Legal Documentation Support Platform,Document • Claim • Guidance • Support,#LegalSupport #DocumentationSupport #ClaimGuidance #MetaSolwServices #Kanpur
COMMERCIAL INSURANCE,COMMERCIAL,COMMERCIAL VEHICLE\nINSURANCE,Commercial vehicle policy direct company support,Get Direct Quote,COMMERCIAL POLICY,Policy issued by Insurance Company,FAST RENEWAL,Commercial renewal support,DIRECT COMPANY,No agent no commission model,Commercial Insurance Support Platform,Commercial • Direct • Renewal • Support,#CommercialInsurance #TruckInsurance #PickupInsurance #DirectPolicy #NoAgent #MetaSolwServices #Kanpur