category,text,cta
Insurance,Bike aur Car Insurance direct company se renew karwayein,No Agent • No Commission
RTO,RTO work ke liye direct support available hai,RC Transfer • Fitness • Permit
Legal,Legal documentation aur claim support ke liye connect karein,Documentation Support
Tax,Income Tax aur GST related consultation available hai,Professional Guidance
Investment,Safe financial planning ke liye expert consultation lein,Plan Smart
Medical,Medical documentation aur support services available hain,Contact MetaSolw
Academic,Academic documentation aur guidance services available hain,Everything Solved
Risk Management,Business aur vehicle risk ko timely manage karein,Stay Protected